{
  "title": "Odd Zeta Values from the PCF Torus: φ and π as Arithmetic-Geometric Sources",
  "description": "We demonstrate that the odd values ζ(2k+1) of the Riemann zeta function are structurally determined by φ=(1+√5)/2 and π. The Euler product of ζ is built from local factors f<sub>p</sub>(s), one for each prime. We prove that the Frobenius lift φ<sup>p</sup> = F<sub>p</sub>φ + F<sub>p-1</sub>—where F<sub>n</sub> is the n-th Fibonacci number—determines the splitting type of every prime p in ℤ[φ], and hence every local factor f<sub>p</sub>(s). These lifts constitute <b>𝔽₁-descent data</b> in the sense of Borger. Through the Dedekind factorisation ζ(s) = ζ<sub>ℚ(√5)</sub>(s)/L(s,χ<sub>5</sub>), this determines ζ(s) completely: the isomorphism between the Frobenius structure and the Euler product is demonstrated at every level (primes, splitting types, local factors, L-function), anchored by the base case L(1,χ<sub>5</sub>) = 2logφ/√5 (the class-number formula for ℚ(√5)), which expresses the L-function value entirely in terms of φ. This resolves the apparent freedom of ζ(2k+1) noted by <b>Elvang, Herderschee and Morales</b> in the N=4 SYM S-matrix bootstrap: those values are free only relative to the EFT; the pentagonal arithmetic fixes them.",
  "version": "1.6.1",
  "publication_date": "2026-07-29",
  "creators": [
    {
      "name": "González García, Jorge Armando",
      "affiliation": "TTAMAYO PUNTO COM, S.A.P.I. de C.V., Research & Development Division, Naucalpan de Juárez, State of Mexico, Mexico",
      "orcid": "0009-0000-2845-5486"
    },
    {
      "name": "González García, Víctor Manuel",
      "affiliation": "TTAMAYO PUNTO COM, S.A.P.I. de C.V., Research & Development Division, Naucalpan de Juárez, State of Mexico, Mexico",
      "orcid": "0009-0009-0935-2954"
    },
    {
      "name": "Dressler Pérez, Itzel Marion",
      "affiliation": "Independent Researcher"
    },
    {
      "name": "García Ordóñez, Luz María",
      "affiliation": "TTAMAYO PUNTO COM, S.A.P.I. de C.V., Research & Development Division, Naucalpan de Juárez, State of Mexico, Mexico"
    }
  ],
  "keywords": [
    "Riemann Hypothesis",
    "Odd zeta values",
    "𝔽₁ (field with one element)",
    "Elliptic curves",
    "λ-rings",
    "String theory",
    "Category theory",
    "Golden ratio",
    "Mersenne primes",
    "Formal verification"
  ],
  "upload_type": "publication",
  "publication_type": "preprint",
  "access_right": "open",
  "license": "CC-BY-4.0",
  "language": "eng",
  "references": [
    "Apéry, Roger (1979). Irrationalité de ζ(2) et ζ(3). Astérisque. 61, 11–13.",
    "Apostol, Tom M. (1976). Introduction to Analytic Number Theory. Springer-Verlag., 340.",
    "Argand, Jean-Robert (1806). Essai sur une manière de représenter les quantités imaginaires dans les constructions géométriques. Madame Veuve Dumesnil.",
    "Baker, A. (1966). Linear forms in the logarithms of algebraic numbers. Mathematika. 13(2), 204–216. https://doi.org/10.1112/S0025579300003971",
    "Ball, Keith; Rivoal, Tanguy (2001). Irrationalité d'une infinité de valeurs de la fonction zêta aux entiers impairs. Invent. Math. 146, 193–207. https://doi.org/10.1007/s002220100168",
    "Borger, James (2009). Λ-rings and the field with one element. arXiv preprint arXiv:0906.3146 [math.NT]. https://doi.org/10.48550/arXiv.0906.3146 https://arxiv.org/abs/0906.3146",
    "Brown, J. D.; Henneaux, Marc (1986). Central charges in the canonical realization of asymptotic symmetries: An example from three dimensional gravity. Communications in Mathematical Physics. 104(2), 207–226. https://doi.org/10.1007/BF01211590",
    "Connes, Alain; Douglas, Michael R.; Schwarz, Albert (1998). Noncommutative geometry and Matrix theory. Journal of High Energy Physics. 1998(02), 003. https://doi.org/10.1088/1126-6708/1998/02/003",
    "Dunford, N.; Schwartz, J. T. (1958). Linear Operators, Part I: General Theory. Interscience Publishers. https://doi.org/10.1007/978-1-4684-8487-1",
    "Elvang, Henriette; Herderschee, Aidan; Morales, Roger (2026). String Theory from Maximal Supersymmetry. arXiv preprint arXiv:2601.11705 [hep-th]. https://doi.org/10.48550/arXiv.2601.11705 https://arxiv.org/abs/2601.11705",
    "Euler, Leonhard (1744). Variae observationes circa series infinitas. Commentarii academiae scientiarum Petropolitanae. 9, 160–188.",
    "Gelfand, Israel M. (1941). Normierte Ringe. Matematicheskii Sbornik. 9(51)(1), 3–24. https://doi.org/10.1070/SM1941v009n05ABEH001847",
    "González García, Jorge Armando; González García, Víctor Manuel; Dressler Pérez, Itzel Marion; García Ordóñez, Luz María; Moreno, M. (2026). The Hilbert-Pólya Operator and the Primitive Structure of the Complex Plane: Between 𝔽₁, String Theory, and Ancient Geometry. Preprint. https://doi.org/10.5281/zenodo.17619486",
    "Grisales Herrera, Javier (2025). Golden Prime Symmetry Theory. University of Tolima, Colombia. https://doi.org/10.5281/zenodo.17100303",
    "Grothendieck, Alexandre (1966). On the de Rham cohomology of algebraic varieties. Publications Mathématiques de l'Institut des Hautes Études Scientifiques. 29(1), 95–103. https://doi.org/10.1007/BF02684807",
    "Heath, Thomas Little (1956). The thirteen books of Euclid's Elements. Courier Corporation.",
    "Hecke, Erich (1920). Eine neue Art von Zetafunktionen und ihre Beziehungen zur Verteilung der Primzahlen (Zweite Mitteilung). Math. Z. 6, 11–51. https://doi.org/10.1007/BF01612081",
    "Kontsevich, Maxim; Zagier, Don (2001). Periods. Mathematics Unlimited — 2001 and Beyond., 771–808. https://doi.org/10.1007/978-3-642-56478-9_39",
    "Lawvere, F. William (1969). Diagonal arguments and cartesian closed categories. Category Theory, Homology Theory and their Applications II., 134–145. https://doi.org/10.1007/BFb0080769",
    "Lindemann, Ferdinand (1882). Über die Zahl π. Mathematische Annalen. 20, 213–225. https://doi.org/10.1007/BF01446522",
    "López Peña, Javier; Lorscheid, Oliver (2011). Torified varieties and their geometries over 𝔽₁. Mathematische Zeitschrift. 267(3), 605–643. https://doi.org/10.1007/s00209-009-0638-0",
    "Maldacena, Juan M. (1999). The Large-ℕ Limit of Superconformal Field Theories and Supergravity. International Journal of Theoretical Physics. 38(4), 1113–1133. https://doi.org/10.1023/A:1026654312961",
    "Manin, Yuri I. (2013). Numbers as functions. P-Adic Numbers, Ultrametric Analysis, and Applications. 5(4), 313–325. https://doi.org/10.1134/S2070046613040055",
    "Neukirch, J. (1999). Algebraic Number Theory. Springer. https://doi.org/10.1007/978-1-4757-5673-9",
    "Riemann, Bernhard (1859). Ueber die Anzahl der Primzahlen unter einer gegebenen Grösse. Monatsberichte der Königlichen Preußischen Akademie der Wissenschaften zu Berlin., 671–680.",
    "Tarski, Alfred (1951). A Decision Method for Elementary Algebra and Geometry. University of California Press.",
    "Veneziano, G. (1968). Construction of a crossing-symmetric, Regge-behaved amplitude for linearly rising trajectories. Nuovo Cimento A. 57, 190–197. https://doi.org/10.1007/BF02895960",
    "Washington, L. C. (1997). Introduction to Cyclotomic Fields. Springer. https://doi.org/10.1007/978-1-4612-1934-7",
    "Weil, André (1940). Une lettre et un extrait de lettre à Simone Weil. André Weil: Oeuvres Scientifiques / Collected Papers. I, 244–255. https://doi.org/10.1007/978-1-4757-3998-5",
    "Yanofsky, Noson S. (2003). A universal approach to self-referential paradoxes, incompleteness and fixed points. Bull. Symb. Log. 9, 362–386. https://doi.org/10.2178/bsl/1058448677"
  ],
  "related_identifiers": [
    {
      "identifier": "https://github.com/omega-pcf/02-odd-zeta",
      "relation": "isSupplementTo",
      "resource_type": "software"
    },
    {
      "identifier": "10.48550/arXiv.2601.11705",
      "relation": "cites",
      "resource_type": "publication-article"
    },
    {
      "identifier": "10.5281/zenodo.17619486",
      "relation": "cites",
      "resource_type": "publication-article"
    },
    {
      "identifier": "10.1007/978-1-4757-5673-9",
      "relation": "cites",
      "resource_type": "publication-book"
    },
    {
      "identifier": "10.1007/978-1-4612-1934-7",
      "relation": "cites",
      "resource_type": "publication-book"
    },
    {
      "identifier": "10.1007/s002220100168",
      "relation": "cites",
      "resource_type": "publication-article"
    },
    {
      "identifier": "10.1007/BF01211590",
      "relation": "cites",
      "resource_type": "publication-article"
    },
    {
      "identifier": "10.1007/BF01612081",
      "relation": "cites",
      "resource_type": "publication-article"
    },
    {
      "identifier": "10.1007/BF02895960",
      "relation": "cites",
      "resource_type": "publication-article"
    },
    {
      "identifier": "10.48550/arXiv.0906.3146",
      "relation": "cites",
      "resource_type": "publication-article"
    },
    {
      "identifier": "10.1134/S2070046613040055",
      "relation": "cites",
      "resource_type": "publication-article"
    },
    {
      "identifier": "10.1007/s00209-009-0638-0",
      "relation": "cites",
      "resource_type": "publication-article"
    },
    {
      "identifier": "10.1007/978-1-4757-3998-5",
      "relation": "cites",
      "resource_type": "publication"
    },
    {
      "identifier": "10.5281/zenodo.17100303",
      "relation": "cites",
      "resource_type": "publication-technicalreport"
    },
    {
      "identifier": "10.1023/A:1026654312961",
      "relation": "cites",
      "resource_type": "publication-article"
    },
    {
      "identifier": "10.1007/BFb0080769",
      "relation": "cites",
      "resource_type": "publication-conferencepaper"
    },
    {
      "identifier": "10.2178/bsl/1058448677",
      "relation": "cites",
      "resource_type": "publication-article"
    },
    {
      "identifier": "10.1088/1126-6708/1998/02/003",
      "relation": "cites",
      "resource_type": "publication-article"